timestamp,datetime,comment-id,author-id,agrees,disagrees,moderated,comment-body
1681230375,Tue Apr 11 2023 16:26:15 GMT+0000 (Coordinated Universal Time),0,0,,,,Cette transformation n’est pas surprenante : les citoyens eux-mêmes consomment l’information sous forme de clashs et de polémiques. Le Parlement ne fait que suivre le mouvement.
1681230375,Tue Apr 11 2023 16:26:15 GMT+0000 (Coordinated Universal Time),1,0,,,,Les réseaux sociaux ont transformé la politique en une course à l’attention. Un discours viral rapporte plus qu’un accord discret.
1681230375,Tue Apr 11 2023 16:26:15 GMT+0000 (Coordinated Universal Time),2,0,,,,"un bon politique est avant tout un bon communicant. La négociation, elle, est invisible et donc peu valorisée."
1681230375,Tue Apr 11 2023 16:26:15 GMT+0000 (Coordinated Universal Time),3,0,,,,"La politique a toujours été théâtrale, mais aujourd’hui, elle est devenue un produit de divertissement."
1681230375,Tue Apr 11 2023 16:26:15 GMT+0000 (Coordinated Universal Time),4,0,,,,"La colère et la polarisation sont des symptômes d’un malaise démocratique plus profond. Ce n’est pas le Parlement qu’il faut réformer, mais notre rapport au débat public."
1681230375,Tue Apr 11 2023 16:26:15 GMT+0000 (Coordinated Universal Time),5,0,,,,"LFI fait du bruit pour exister médiatiquement, le RN cherche à se ""normaliser""."
